,subreddit,selftext,title,posts
4,0,"There have been some users (trolls) who’ve been very keen to come up with a justification for the recent iPad Pros being bent out of the box. 

This isn’t an isolated cause. This isn’t an expected product defect or a rare case, it’s a flaw. It’s Apple’s flaw. 

**Remember, there’s a difference between some marginal product defects vs a product with a flawed design**. 

Remember what happened with the iPhone 6? Apple pretended that it was completely normal and ignored the issue for a while before using Series 7000 Aluminium on the 6S to make the phone more durable. This happened because Apple figured that they made a mistake with the iPhone 6, the material used to build that phone wasn’t of a durable quality apparently. The same has happened with the iPad. 

It’s so thin at this point that it bends when applied with even **normal** level of pressure. However some trolls are pretending that this issue is completely normal, it’s expected and it’s a non issue if you get it replaced. 

The thing is, **each and every** iPad Pro 2018 is built like this. So even if it doesn’t come bent out of the box, it will bend when put through routine levels of force... that’s just poor design. ","The new iPad Pro being bent isn’t a rare, isolated case. Rather it’s a design flaw, a result of Apple’s pointless obsession with thinness","There have been some users (trolls) who’ve been very keen to come up with a justification for the recent iPad Pros being bent out of the box. 

This isn’t an isolated cause. This isn’t an expected product defect or a rare case, it’s a flaw. It’s Apple’s flaw. 

**Remember, there’s a difference between some marginal product defects vs a product with a flawed design**. 

Remember what happened with the iPhone 6? Apple pretended that it was completely normal and ignored the issue for a while before using Series 7000 Aluminium on the 6S to make the phone more durable. This happened because Apple figured that they made a mistake with the iPhone 6, the material used to build that phone wasn’t of a durable quality apparently. The same has happened with the iPad. 

It’s so thin at this point that it bends when applied with even **normal** level of pressure. However some trolls are pretending that this issue is completely normal, it’s expected and it’s a non issue if you get it replaced. 

The thing is, **each and every** iPad Pro 2018 is built like this. So even if it doesn’t come bent out of the box, it will bend when put through routine levels of force... that’s just poor design. The new iPad Pro being bent isn’t a rare, isolated case. Rather it’s a design flaw, a result of Apple’s pointless obsession with thinness"
5,0,Wanna see keywords of simular apps,"Hello, friends! A quick questions: can i access keywords of published apps?","Wanna see keywords of simular appsHello, friends! A quick questions: can i access keywords of published apps?"
6,0,"I have major issues with the search function, searches like “joe Rogan episode 486” turn up no results and the organization of the “listen now” tab is way to cluttered in my opinion. ",Anyone else thing the Apple podcast app is long past due for a major overhaul?,"I have major issues with the search function, searches like “joe Rogan episode 486” turn up no results and the organization of the “listen now” tab is way to cluttered in my opinion. Anyone else thing the Apple podcast app is long past due for a major overhaul?"
7,0,,"TIL if you double tap on the minutes, you can change from 1 minute to 5 minute intervals.","TIL if you double tap on the minutes, you can change from 1 minute to 5 minute intervals."
8,0,"Hi everyone. Late 2013 15"" retina MBP user here. It's been running great for 5 years now except for (of course) the battery. I'm at just over 1000 cycles. Battery life isn't too bad, but the laptop has started going to sleep while on battery (even though the battery isn't out of power). It's happened 6 times in the last 3 weeks, and the only way to get it back up is to power it on while plugged in.

My questions are:

1) Is there any short-term fix for the above issue?

2) Would you recommend (a) have Apple replace the battery (b) have my local repair guys replace the battery or (c) replace the laptop instead? I don't have AppleCare so I'd be paying Apple $199 - but have heard their service isn't entirely dependable and that they can decide to charge you more once they have your laptop, is this likely to happen in my particular case? Having my local guy do it is cheaper and faster but I wonder about the risk of a cheaper replacement battery failing.",Questions about MBP battery replacement,"Hi everyone. Late 2013 15"" retina MBP user here. It's been running great for 5 years now except for (of course) the battery. I'm at just over 1000 cycles. Battery life isn't too bad, but the laptop has started going to sleep while on battery (even though the battery isn't out of power). It's happened 6 times in the last 3 weeks, and the only way to get it back up is to power it on while plugged in.

My questions are:

1) Is there any short-term fix for the above issue?

2) Would you recommend (a) have Apple replace the battery (b) have my local repair guys replace the battery or (c) replace the laptop instead? I don't have AppleCare so I'd be paying Apple $199 - but have heard their service isn't entirely dependable and that they can decide to charge you more once they have your laptop, is this likely to happen in my particular case? Having my local guy do it is cheaper and faster but I wonder about the risk of a cheaper replacement battery failing.Questions about MBP battery replacement"
9,0,"Hello, r/apple

I received a couple of fancy-schmancy Criterion Blu-rays over the holidays, and I'd love to play them on my iMac.

I've already got an external Blu-ray player, but I'm struggling to find a cheap, respectable program.  The internet, it seems, is littered with junky or overpriced solutions, and I was hoping one of you fine people may have a recommendation...",Blu-ray on Mac,"Hello, r/apple

I received a couple of fancy-schmancy Criterion Blu-rays over the holidays, and I'd love to play them on my iMac.

I've already got an external Blu-ray player, but I'm struggling to find a cheap, respectable program.  The internet, it seems, is littered with junky or overpriced solutions, and I was hoping one of you fine people may have a recommendation...Blu-ray on Mac"
10,0,"It seems like there is a constant rotation of deep discounts on Apple products between B&amp;H, Best Buy, Amazon, Costco, etc. Right now, B&amp;H has the new Air for $999, the price we were all expecting it to be. You can get the $1799 13” Pro for $1599. The $2099 model is $1699. The Mac Mini is constantly on sale for $100. I’ve seen $50-100 off the new iPad Pro’s. HomePod is now frequently $249. 

Is Apple becoming a company where they set prices at a higher MSRP with the expectation that retailers are going to put them on sale? It wasn’t really like this 5 years ago. I worked at Apple Retail 2009-2012, and I never remember our competitor stores having major ‘deals.’

This punishes the customer who buys on Apple.com not knowing they could be saving hundreds by buying elsewhere. This also hurts the customer who needs a custom config, like adding extra RAM, as it seems like it is just the ‘stock’ options that get big sales.

Seeing how often these deals come through, I’m not sure I’d ever pay retail price for an Apple product again!",Apple’s higher prices - so they can have flash sales?,"It seems like there is a constant rotation of deep discounts on Apple products between B&amp;H, Best Buy, Amazon, Costco, etc. Right now, B&amp;H has the new Air for $999, the price we were all expecting it to be. You can get the $1799 13” Pro for $1599. The $2099 model is $1699. The Mac Mini is constantly on sale for $100. I’ve seen $50-100 off the new iPad Pro’s. HomePod is now frequently $249. 

Is Apple becoming a company where they set prices at a higher MSRP with the expectation that retailers are going to put them on sale? It wasn’t really like this 5 years ago. I worked at Apple Retail 2009-2012, and I never remember our competitor stores having major ‘deals.’

This punishes the customer who buys on Apple.com not knowing they could be saving hundreds by buying elsewhere. This also hurts the customer who needs a custom config, like adding extra RAM, as it seems like it is just the ‘stock’ options that get big sales.

Seeing how often these deals come through, I’m not sure I’d ever pay retail price for an Apple product again!Apple’s higher prices - so they can have flash sales?"
11,0,"Today’s gotta be the day, people. ",AirPower delay update day,"Today’s gotta be the day, people. AirPower delay update day"
12,0,"It’s quite simple really, I want to be able to use the amount of GB storage I buy without System Storage taking up 1/3 of my available space. Syncing to iTunes only brings it down to about 8 GB around 1/3 of a 32 GB apple products storage. It’s beyond redundant and this issue is tiresome to deal with every other month as System Storage magically grows until you Sync it with iTunes or it becomes an issue by taking up too much space. It also seems to just happily take up more System Storage the more space you have on your device. My 64 GB iPad Pro 11 inch model easily has 15-20 GB in System Storage at any given time, always changing as well. This is a huge draw back that has been an inconvenience to many Apple users and I’d personally just like to get the use out of the GB I bought. ","2019 is right around the corner, can we please get a fix to this System Storage issue that hinders Apple devices?","It’s quite simple really, I want to be able to use the amount of GB storage I buy without System Storage taking up 1/3 of my available space. Syncing to iTunes only brings it down to about 8 GB around 1/3 of a 32 GB apple products storage. It’s beyond redundant and this issue is tiresome to deal with every other month as System Storage magically grows until you Sync it with iTunes or it becomes an issue by taking up too much space. It also seems to just happily take up more System Storage the more space you have on your device. My 64 GB iPad Pro 11 inch model easily has 15-20 GB in System Storage at any given time, always changing as well. This is a huge draw back that has been an inconvenience to many Apple users and I’d personally just like to get the use out of the GB I bought. 2019 is right around the corner, can we please get a fix to this System Storage issue that hinders Apple devices?"
13,0,,Mac Blu Ray Software,Mac Blu Ray Software
14,0,"It seems like every Apple forum and podcast has been on a never ending debate of iPad vs Mac since Apple really started positioning the iPad as a computer with the iPad Pro. However, who is the one party sitting out of the debate? Apple themselves. 

In all forms of their marketing, they really try to avoid the issue. Apple has pages on apple.com comparing iPads to each other and comparing Macs to each other, but there is no page comparing Macs to iPads. No page explaining the differences. If you know nothing about what to buy, Apple provides zero guidance. It’s like Apple has two alternative universes of computers, and they completely pretend that the other doesn’t exist. Who does Apple think should get an iPad? Who does Apple think should get a Mac? We don’t know. 

I get that Apple has to tip toe around the issue a bit because they don’t want to present weaknesses in either of their products, but perhaps they could still present the differences in a factual manner.",Mac vs iPad - the debate that Apple sits out of,"It seems like every Apple forum and podcast has been on a never ending debate of iPad vs Mac since Apple really started positioning the iPad as a computer with the iPad Pro. However, who is the one party sitting out of the debate? Apple themselves. 

In all forms of their marketing, they really try to avoid the issue. Apple has pages on apple.com comparing iPads to each other and comparing Macs to each other, but there is no page comparing Macs to iPads. No page explaining the differences. If you know nothing about what to buy, Apple provides zero guidance. It’s like Apple has two alternative universes of computers, and they completely pretend that the other doesn’t exist. Who does Apple think should get an iPad? Who does Apple think should get a Mac? We don’t know. 

I get that Apple has to tip toe around the issue a bit because they don’t want to present weaknesses in either of their products, but perhaps they could still present the differences in a factual manner.Mac vs iPad - the debate that Apple sits out of"
15,0,,The iPad Pro continues to sell well despite bent product complaints,The iPad Pro continues to sell well despite bent product complaints
16,0,I’m looking to upgrade my 2015 Rose Gold MacBook to something a bit more sturdy and powerful. I can buy refurbished MacBooks from a reputable re-seller. Pretty much all models are available. Can somebody tell me what the best models to get are right now? I heard lots of criticism about the 2017 models. I just don’t want to end up with a dud. ,What’s the best MacBook available right now?,I’m looking to upgrade my 2015 Rose Gold MacBook to something a bit more sturdy and powerful. I can buy refurbished MacBooks from a reputable re-seller. Pretty much all models are available. Can somebody tell me what the best models to get are right now? I heard lots of criticism about the 2017 models. I just don’t want to end up with a dud. What’s the best MacBook available right now?
17,0,Hi all! I installed a new Samsung SSD 860 EVO in my macbook pro and backed up my hard drive to an external drive (both are done). Now I am trying to use Time Machine to restore my computer to the newly installed ssd but when I get to the “Select a Destination” step it says “Searching for disks…” and can’t seem to find anything. Please help!,Installed new Samsung SSD but Time Machine can't find destination,Hi all! I installed a new Samsung SSD 860 EVO in my macbook pro and backed up my hard drive to an external drive (both are done). Now I am trying to use Time Machine to restore my computer to the newly installed ssd but when I get to the “Select a Destination” step it says “Searching for disks…” and can’t seem to find anything. Please help!Installed new Samsung SSD but Time Machine can't find destination
18,0,,‎Greatest Hits 3 by Dane on iTunes,‎Greatest Hits 3 by Dane on iTunes
19,0,"Hi all, I’ll premise this by saying that I’m an architect and the iPad Pro has drastically improved the way I work. I have a 2017 12.9” iPad Pro that I use for 2-3 hours each day for sketching, writing emails, web, etc. I absolutely love this device, but have had a severe issue over the past 18 months. 

My issue is that after about 6 months of use, my iPad’s touch screen would become more and more unresponsive. At first, it would only happen sporadically. I’d be typing, and the keyboard would miss a few keys. After a few more weeks, the touchscreen would become completely unresponsive after an hour of heavy use. Putting the device into sleep would fix it temporarily, but it would happen again after 30 mins or so. This problem would get drastically worse until the device was almost unusable. Even powering off the device and rebooting would not solve it. I did a clean install on the device (with and without restoring from backup) and the problem would get better, but reemerge over time.

Luckily, I have Applecare. I brought the device in, and Apple swapped it out for me free of charge. Then, after a few months the probably happened again. Again, I went through the same steps and got a new device from Apple. I am now on my third iPad from Apple. And the touchscreen has just started getting worse again. I’m typing this on my Smart Keyboard, because the touchscreen is barely useable right now.

Has anyone had an issue like this and know what may be causing it? Is it a rogue app on my machine? Am I using the iPad beyond its capacity? Are there any other options besides getting another refurbished device?

Thanks all for your help.","On my 3rd iPad because of touchscreen unresponsiveness, anyone have a solution?","Hi all, I’ll premise this by saying that I’m an architect and the iPad Pro has drastically improved the way I work. I have a 2017 12.9” iPad Pro that I use for 2-3 hours each day for sketching, writing emails, web, etc. I absolutely love this device, but have had a severe issue over the past 18 months. 

My issue is that after about 6 months of use, my iPad’s touch screen would become more and more unresponsive. At first, it would only happen sporadically. I’d be typing, and the keyboard would miss a few keys. After a few more weeks, the touchscreen would become completely unresponsive after an hour of heavy use. Putting the device into sleep would fix it temporarily, but it would happen again after 30 mins or so. This problem would get drastically worse until the device was almost unusable. Even powering off the device and rebooting would not solve it. I did a clean install on the device (with and without restoring from backup) and the problem would get better, but reemerge over time.

Luckily, I have Applecare. I brought the device in, and Apple swapped it out for me free of charge. Then, after a few months the probably happened again. Again, I went through the same steps and got a new device from Apple. I am now on my third iPad from Apple. And the touchscreen has just started getting worse again. I’m typing this on my Smart Keyboard, because the touchscreen is barely useable right now.

Has anyone had an issue like this and know what may be causing it? Is it a rogue app on my machine? Am I using the iPad beyond its capacity? Are there any other options besides getting another refurbished device?

Thanks all for your help.On my 3rd iPad because of touchscreen unresponsiveness, anyone have a solution?"
20,0,"hi

over thanksgiving i purchased a new macbook air. using migration assistant, i transferred all of my documents from my macbook pro to the air, no problems. last night, my i volunteered to let my sister take my macbook pro. so, we moved all the documents from the desktop to the trash, and deleted the trash. i was never signed out of icloud there, like a dumbass, so of course on my new macbook air, everything is deleted as well. 

when i log in to icloud and go to settings, restore files, it only shows me 6 files deleted a month ago. why wouldn't it show anything from the previous month? is there no way i can access the data from the migration assistant? why can't i use icloud drive to restore from my desktop from like two weeks ago?? what is the point of backing everything up to the cloud if i can't restore it in this instance??? it's mostly work documents and spreadsheets etc. are there apps that do this? i found one called EaseUS Data Recovery Wizard but I don't know if it's junk. i'm on the phone now with apple but the woman isn't very helpful, i may go to the genius bar later. ",trying to restore docs from icloud drive,"hi

over thanksgiving i purchased a new macbook air. using migration assistant, i transferred all of my documents from my macbook pro to the air, no problems. last night, my i volunteered to let my sister take my macbook pro. so, we moved all the documents from the desktop to the trash, and deleted the trash. i was never signed out of icloud there, like a dumbass, so of course on my new macbook air, everything is deleted as well. 

when i log in to icloud and go to settings, restore files, it only shows me 6 files deleted a month ago. why wouldn't it show anything from the previous month? is there no way i can access the data from the migration assistant? why can't i use icloud drive to restore from my desktop from like two weeks ago?? what is the point of backing everything up to the cloud if i can't restore it in this instance??? it's mostly work documents and spreadsheets etc. are there apps that do this? i found one called EaseUS Data Recovery Wizard but I don't know if it's junk. i'm on the phone now with apple but the woman isn't very helpful, i may go to the genius bar later. trying to restore docs from icloud drive"
21,0,"Is there an app for this? I have an iPhone X for a month and it charges for hours (comparing to my previous 6s). My iPad charger is behind the bed in another room and I find myself constantly going there and checking if iPhone has fully charged. One year ago, when I bought AW S3 , I could ask Siri ""What's my iphone battery level?"" and she told me all I needed to know. Right now when I ask the same question, she tells me my Apple Watch battery level. Pointless. Why Apple? Why did you remove such an useful feature? ",Notification on my watch when iPhone is fully charged,"Is there an app for this? I have an iPhone X for a month and it charges for hours (comparing to my previous 6s). My iPad charger is behind the bed in another room and I find myself constantly going there and checking if iPhone has fully charged. One year ago, when I bought AW S3 , I could ask Siri ""What's my iphone battery level?"" and she told me all I needed to know. Right now when I ask the same question, she tells me my Apple Watch battery level. Pointless. Why Apple? Why did you remove such an useful feature? Notification on my watch when iPhone is fully charged"
22,0,"I had an issue not too long ago in which my MagSafe 1 charger, when connected to my MacBook Pro, doesn’t charge the laptop, and no light shows up on the charger, but the battery doesn’t actually go down on my MacBook. I was told to reset the SMC, and although that didn’t work at first I woke up one day to find that the problem was magically rectified. Now, however, the problem is back and resetting the SMC has no effect ","MagSafe 1 won’t charge a MacBook Pro, but the battery isn’t going down?","I had an issue not too long ago in which my MagSafe 1 charger, when connected to my MacBook Pro, doesn’t charge the laptop, and no light shows up on the charger, but the battery doesn’t actually go down on my MacBook. I was told to reset the SMC, and although that didn’t work at first I woke up one day to find that the problem was magically rectified. Now, however, the problem is back and resetting the SMC has no effect MagSafe 1 won’t charge a MacBook Pro, but the battery isn’t going down?"
23,0,,Apple type of Christmas 🍎🎄,Apple type of Christmas 🍎🎄
24,0,,Looks like iOS Macs are out finally 😂,Looks like iOS Macs are out finally 😂
25,0,,"Yeah, so... fuck this","Yeah, so... fuck this"
26,0,"I've had so many phones and cases over the years, I usually switch them out every year when they get dirty or broken. I have never really found a ""Perfect"" case, but I have fantasized about using one of those iPad Smart covers on a phone. Something exactly like this:

https://www.apple.com/shop/product/MQ4L2ZM/A/ipad-smart-cover-charcoal-gray?afid=p238%7CsutbSLz6B-dc_mtid_1870765e38482_pcrid_246386726280_&amp;cid=aos-us-kwgo-pla-btb--slid--product-MQ4L2ZM/A

But that magnetically clicks to the iPhone and works the same way it does on the ipad. Why doesn't something like this exist. How hard would it be for Apple to adapt their already trademarked cover to fit a cell phone...??",Why doesn't Apple make Smart Cover's for iPhones?,"I've had so many phones and cases over the years, I usually switch them out every year when they get dirty or broken. I have never really found a ""Perfect"" case, but I have fantasized about using one of those iPad Smart covers on a phone. Something exactly like this:

https://www.apple.com/shop/product/MQ4L2ZM/A/ipad-smart-cover-charcoal-gray?afid=p238%7CsutbSLz6B-dc_mtid_1870765e38482_pcrid_246386726280_&amp;cid=aos-us-kwgo-pla-btb--slid--product-MQ4L2ZM/A

But that magnetically clicks to the iPhone and works the same way it does on the ipad. Why doesn't something like this exist. How hard would it be for Apple to adapt their already trademarked cover to fit a cell phone...??Why doesn't Apple make Smart Cover's for iPhones?"
27,0,[removed],Thinking of buying a new Mac but question about the t2 chip,[removed]Thinking of buying a new Mac but question about the t2 chip
28,0,"apple products are so ridiculously expensive relative to what the specs are? I know its not fair but if you compare car pricing you understand why there is such a huge difference between say a Toyota celica and a luxury sedan or sports car. you can visibly see the performance and luxury aspects in the more expensive car. but when you compare iPhone or iMac to another similar device you actually get more for your money (memory, CPU, GPU, etc) from anything that isn't apple. so logically, one would want the most for their money and come to the conclusion apple products are simply overpriced luxury items. But people continually buy their products religiously...why?",Can someone tell me why,"apple products are so ridiculously expensive relative to what the specs are? I know its not fair but if you compare car pricing you understand why there is such a huge difference between say a Toyota celica and a luxury sedan or sports car. you can visibly see the performance and luxury aspects in the more expensive car. but when you compare iPhone or iMac to another similar device you actually get more for your money (memory, CPU, GPU, etc) from anything that isn't apple. so logically, one would want the most for their money and come to the conclusion apple products are simply overpriced luxury items. But people continually buy their products religiously...why?Can someone tell me why"
