,subreddit,selftext,title,posts
0,1,"Hey everyone, what’re yalls reviews on the

Arpeggio
Nicaragua 
Genova Livanto 
Caramel Creme brûlée 

I ordered these blindly and I’m hoping I enjoy them!",Pod Reviews!,"Hey everyone, what’re yalls reviews on the

Arpeggio
Nicaragua 
Genova Livanto 
Caramel Creme brûlée 

I ordered these blindly and I’m hoping I enjoy them!Pod Reviews!"
1,1,I was wondering how much of the aluminium pod gets recycled when I send the bags away? I can't find any info for it.,coffee pod recycling?,I was wondering how much of the aluminium pod gets recycled when I send the bags away? I can't find any info for it.coffee pod recycling?
2,1,Compared to the one from Cuba which one you prefer or neither?,Puerto Rico capsule any good,Compared to the one from Cuba which one you prefer or neither?Puerto Rico capsule any good
3,1,"I recently got a Google Nest, and I'd love to be able to make it work with my Nespresso Expert.

I already have the Nespresso app, which allows me to use my phone to make coffee (now or set a timer). Does anyone know of any way I can just ask Google to make me some coffee?",Nespresso Expert + Google Home?,"I recently got a Google Nest, and I'd love to be able to make it work with my Nespresso Expert.

I already have the Nespresso app, which allows me to use my phone to make coffee (now or set a timer). Does anyone know of any way I can just ask Google to make me some coffee?Nespresso Expert + Google Home?"
4,1,"Went out and picked up Ice Forte (vertuo) and have made Vietnamese Iced Coffee with Condensed Milk and absolutely LOVE IT! 

Haven't tried the Leggero though - would it make the Vietnamese coffee taste much different? If so, what would the difference in taste be?",Ice Leggero vs. Ice Forte,"Went out and picked up Ice Forte (vertuo) and have made Vietnamese Iced Coffee with Condensed Milk and absolutely LOVE IT! 

Haven't tried the Leggero though - would it make the Vietnamese coffee taste much different? If so, what would the difference in taste be?Ice Leggero vs. Ice Forte"
5,1,[deleted],How Nespresso's Coffee Revolution Got Ground Down (article.. thoughts?),[deleted]How Nespresso's Coffee Revolution Got Ground Down (article.. thoughts?)
6,1,,"Is this amount of ""crema"" normal?","Is this amount of ""crema"" normal?"
7,1,[deleted],I need some help.,[deleted]I need some help.
8,1,"Hi all,

I'm looking at buying a nespresso essenza mini so I can enjoy some espresso from home. Is this the model I should buy? Or should I be looking at a different model? 

I'm also looking to buy some pods – any recommendations? What's popular? I'm not a fan of overly bitter, but other than that, I'm not too picky.

&amp;#x200B;

Thanks for your help!",Am I making the right purchase (and pod flavor suggestions)?,"Hi all,

I'm looking at buying a nespresso essenza mini so I can enjoy some espresso from home. Is this the model I should buy? Or should I be looking at a different model? 

I'm also looking to buy some pods – any recommendations? What's popular? I'm not a fan of overly bitter, but other than that, I'm not too picky.

&amp;#x200B;

Thanks for your help!Am I making the right purchase (and pod flavor suggestions)?"
9,1,,Ice Leggro is legit!,Ice Leggro is legit!
10,1,,Hot milk + Linizio Lungo + milk foam,Hot milk + Linizio Lungo + milk foam
11,1,"So the other day, I got a notification that my machine plan order shipped, but there were no credits in my account so I contacted them, they said they were going to contact the department that handles the credits, shortly after there was credits in my account, so I went ahead and used them for a coffee purchase, yesterday, my plan became “active” and another round of credits became available, should I use them or just wait?",Dilemma,"So the other day, I got a notification that my machine plan order shipped, but there were no credits in my account so I contacted them, they said they were going to contact the department that handles the credits, shortly after there was credits in my account, so I went ahead and used them for a coffee purchase, yesterday, my plan became “active” and another round of credits became available, should I use them or just wait?Dilemma"
12,1,,How Nespresso's coffee revolution got ground down - an article in the Guardian Newspaper (UK) today,How Nespresso's coffee revolution got ground down - an article in the Guardian Newspaper (UK) today
13,1,"Hi all! I recently bought myself the Creatista Pro and I’m looking for the best almond or oat milk options s for frothing and steaming. Has anyone tried and can give me a suggestion?
Thanks!",Best milk alternatives in Australia,"Hi all! I recently bought myself the Creatista Pro and I’m looking for the best almond or oat milk options s for frothing and steaming. Has anyone tried and can give me a suggestion?
Thanks!Best milk alternatives in Australia"
14,1,"Have been using the original machine for years and decided (with much excitement) to upgrade to the Vertuo machine as a gift to hubby. The first machine had a terrible taste of plastic that wouldn't dissipate after multiple rinses. We could taste it in the coffee, it was undrinkable. Exchanged the machine for another Vertuo machine hoping that it was a one-off with the first machine. Unfortunately with this machine, after multiple rinse cycles (including long descale cycle with just water) and multiple $$$ undrinkable coffees dumped down the sink, it's the same thing. It's been 5 days and we can still taste the plastic in the coffee. Has anyone else experienced this? I feel like throwing the thing out the window (but for the hundreds of dollars spent). Nespresso denies there's a problem.",New Vertuo Machine #2 tastes like plastic after multiple rinses/pours,"Have been using the original machine for years and decided (with much excitement) to upgrade to the Vertuo machine as a gift to hubby. The first machine had a terrible taste of plastic that wouldn't dissipate after multiple rinses. We could taste it in the coffee, it was undrinkable. Exchanged the machine for another Vertuo machine hoping that it was a one-off with the first machine. Unfortunately with this machine, after multiple rinse cycles (including long descale cycle with just water) and multiple $$$ undrinkable coffees dumped down the sink, it's the same thing. It's been 5 days and we can still taste the plastic in the coffee. Has anyone else experienced this? I feel like throwing the thing out the window (but for the hundreds of dollars spent). Nespresso denies there's a problem.New Vertuo Machine #2 tastes like plastic after multiple rinses/pours"
15,1,"IMHO, these pods taste like melted coffee ice cream and I’m completely smitten. 

I ordered a sleeve last week and made 2 cups because I enjoyed it so much. I drank the first one plain and made the second cup into a latte and it was just wonderful. 

Anyone else really love these pods and can point me to others I might enjoy equally?

Thanks so much for any suggestions wonderful humans.",Love “Indonesia” pods; any others like them worth checking out?,"IMHO, these pods taste like melted coffee ice cream and I’m completely smitten. 

I ordered a sleeve last week and made 2 cups because I enjoyed it so much. I drank the first one plain and made the second cup into a latte and it was just wonderful. 

Anyone else really love these pods and can point me to others I might enjoy equally?

Thanks so much for any suggestions wonderful humans.Love “Indonesia” pods; any others like them worth checking out?"
16,1,Anyone know? The customer service rep I spoke to said she couldn’t comment on it.,Will the CA boutiques be closing again now?,Anyone know? The customer service rep I spoke to said she couldn’t comment on it.Will the CA boutiques be closing again now?
17,1,"I travel a bunch by car, and want to take my essenza mini with me. Has anyone found a good case for it?

I was considering a laptop bag, but not sure any are wide enough.",Case for essenza mini,"I travel a bunch by car, and want to take my essenza mini with me. Has anyone found a good case for it?

I was considering a laptop bag, but not sure any are wide enough.Case for essenza mini"
18,1,"Just received my Lattissimo Pro via Nepresso's Machine Plan (LOVE IT!) and tried to use the Welcome Gift promo code along with ordering more caspules. Unfortuantely, it wont accept the code. I already have a Nespresso Vertuo Evoluo registered back in 2016 (still use it) and received the Welcome Gift from back then, but they didn't include glasses. The current Welcome Gift includes glasses, which I want. 

Does anyone here have more than one machine registered with Nepsresso and received a Welcome Gift for each machine? Anyone have expierence with this?",Is the Nepsresso Welcome Gift only for brand new customers or every new machine you buy?,"Just received my Lattissimo Pro via Nepresso's Machine Plan (LOVE IT!) and tried to use the Welcome Gift promo code along with ordering more caspules. Unfortuantely, it wont accept the code. I already have a Nespresso Vertuo Evoluo registered back in 2016 (still use it) and received the Welcome Gift from back then, but they didn't include glasses. The current Welcome Gift includes glasses, which I want. 

Does anyone here have more than one machine registered with Nepsresso and received a Welcome Gift for each machine? Anyone have expierence with this?Is the Nepsresso Welcome Gift only for brand new customers or every new machine you buy?"
19,1,"We have had our Creatista Plus for about two years &amp; have been very happy with it, but as of late the cup drawer &amp; capsule bucket don't want to eject &amp; I suspect it's getting stuck from coffee in the little clips behind both the cup drawer &amp; capsule bucket.

Doe anyone have any idea what could be done to get this fixed. Should I get in touch with Nespresso support? This sort of thing is often very costly &amp; I don't want to spend a fortune getting this sorted out.",Creatista Plus cup drawer &amp; capsule bucket getting stuck,"We have had our Creatista Plus for about two years &amp; have been very happy with it, but as of late the cup drawer &amp; capsule bucket don't want to eject &amp; I suspect it's getting stuck from coffee in the little clips behind both the cup drawer &amp; capsule bucket.

Doe anyone have any idea what could be done to get this fixed. Should I get in touch with Nespresso support? This sort of thing is often very costly &amp; I don't want to spend a fortune getting this sorted out.Creatista Plus cup drawer &amp; capsule bucket getting stuck"
20,1,,Help identifying this limited edition original pod!,Help identifying this limited edition original pod!
21,1,"Hey everyone, what’s yalls views on the Starbucks pods? My local grocery store had sleeves on clearance for $4 per sleeve so I picked up a few, my citiz comes in a few days, so if you could also tell me about some of your favorite pods that’d be amazing. I already own a vertuo, my favorite pods in that like are the scuro, fortado, and decaf intenso.",Pod Insight,"Hey everyone, what’s yalls views on the Starbucks pods? My local grocery store had sleeves on clearance for $4 per sleeve so I picked up a few, my citiz comes in a few days, so if you could also tell me about some of your favorite pods that’d be amazing. I already own a vertuo, my favorite pods in that like are the scuro, fortado, and decaf intenso.Pod Insight"
22,1,How long did it take for your credits to become available after your order shipped?,Machine Plan Credits,How long did it take for your credits to become available after your order shipped?Machine Plan Credits
23,1,,Cafecito de Puerto Rico and review,Cafecito de Puerto Rico and review
24,1,,First night shift back after almost 3 weeks off definitely calls for double Starbucks Espresso 👌🏻,First night shift back after almost 3 weeks off definitely calls for double Starbucks Espresso 👌🏻
25,1,"Hi, could someone with a Creatista Uno do me a quick favor and measure height with the lever up? We've got a tight space and I want to make sure it will fit, and all the dimensions online are with the lever down.",Creatista Uno Dimensions with lever up,"Hi, could someone with a Creatista Uno do me a quick favor and measure height with the lever up? We've got a tight space and I want to make sure it will fit, and all the dimensions online are with the lever down.Creatista Uno Dimensions with lever up"
26,1,,"Making an Iced Americano with Fresh Ground Coffee - Double Shot Capsule, 16oz Glass, Ice, Cold Water and a Dash of Half-and-Half","Making an Iced Americano with Fresh Ground Coffee - Double Shot Capsule, 16oz Glass, Ice, Cold Water and a Dash of Half-and-Half"
27,1,,How To Make Iced Latte With Nespresso Ice Leggro Capsules - Easy &amp; Delicious! 😋,How To Make Iced Latte With Nespresso Ice Leggro Capsules - Easy &amp; Delicious! 😋
28,1,,Enjoying an iced hazelnut latte before heading to work to direct the morning news!,Enjoying an iced hazelnut latte before heading to work to direct the morning news!
29,1,"Does anyone know why the Nespresso app is tacking on an extra $0.15 per sleeve of Original capsules? If you add 1 sleeve of capsules (10 @ $0.75) the total before shipping should be $7.50. The app shows that, then tacks on an additional $0.15 per sleeve so the total is now $7.65. I’m hoping this is just a bug as it may not seem like anything to bat an eye at but if you were to multiply that times thousands of sleeves it could equal $$$.",App over charging?,"Does anyone know why the Nespresso app is tacking on an extra $0.15 per sleeve of Original capsules? If you add 1 sleeve of capsules (10 @ $0.75) the total before shipping should be $7.50. The app shows that, then tacks on an additional $0.15 per sleeve so the total is now $7.65. I’m hoping this is just a bug as it may not seem like anything to bat an eye at but if you were to multiply that times thousands of sleeves it could equal $$$.App over charging?"
30,1,,"My coffee arrived, with my welcome gift too!","My coffee arrived, with my welcome gift too!"
31,1,"Mentioned the subscription plan, and they said they couldn’t find it in their system, but that if I bought 30 sleeves they’d give it to me for $1. 

I thought it was a great deal but I didn’t get the machine or color I wanted. In the end, that’s purely aesthetic and I can do without. 

But, if anyone has a newish domed white vertuo machine that they want to trade for a gray vertuonext, I’m down to talk. 

By the way, I’m in Houston.",Managed to snag a Vertuo Next (gray:/) at a Nespresso boutique for $1.,"Mentioned the subscription plan, and they said they couldn’t find it in their system, but that if I bought 30 sleeves they’d give it to me for $1. 

I thought it was a great deal but I didn’t get the machine or color I wanted. In the end, that’s purely aesthetic and I can do without. 

But, if anyone has a newish domed white vertuo machine that they want to trade for a gray vertuonext, I’m down to talk. 

By the way, I’m in Houston.Managed to snag a Vertuo Next (gray:/) at a Nespresso boutique for $1."
32,1,"I am interested to buy the NEW « Vertuo Next » with Bluetooth and WiFi option. But I also see the « VertuoPlus Deluxe w/Aeroccino Bundle » at 30% off on the Canadian Nespresso site. What is the advantage of buying the Vertuo Next vs the VertuoPlus ? Do you have any advice to help me to make my choice ? 

Thanks‼️❣️",Need advice purchasing first Nespresso machine,"I am interested to buy the NEW « Vertuo Next » with Bluetooth and WiFi option. But I also see the « VertuoPlus Deluxe w/Aeroccino Bundle » at 30% off on the Canadian Nespresso site. What is the advantage of buying the Vertuo Next vs the VertuoPlus ? Do you have any advice to help me to make my choice ? 

Thanks‼️❣️Need advice purchasing first Nespresso machine"
33,1,,Can you ever have too much coffee? Answer is always no 😂,Can you ever have too much coffee? Answer is always no 😂
34,1,"I have under-machine organizers for all three of my coffeemakers, and until this afternoon I was using a pair of ugly plastic drawer-based Originaline organizers from Container Store for additional capsules. Finally got around to getting a replacement to hang on the wall instead.

It's a Lungogo hanging holder I bought on Amazon. Holds up to 65 capsules in four rings (plus one ""capsule of honor"" spot).

Outside ring: Lungos (Envivo and Fortissio)

Second ring: Ciocattino and older Brew Over Ice capsules (Leggero and Intenso?)

Third ring: Praline and 2016 Limited I believe.

Fourth ring: Peru Secreto and the 2014 vintage

Inner ring: a lone Paris Black.

https://preview.redd.it/geo9bngcnha51.jpg?width=2048&amp;format=pjpg&amp;auto=webp&amp;s=2b8c05910d175141b48aaaa9cded121892fe2f8b",New organization method for my Originaline capsules,"I have under-machine organizers for all three of my coffeemakers, and until this afternoon I was using a pair of ugly plastic drawer-based Originaline organizers from Container Store for additional capsules. Finally got around to getting a replacement to hang on the wall instead.

It's a Lungogo hanging holder I bought on Amazon. Holds up to 65 capsules in four rings (plus one ""capsule of honor"" spot).

Outside ring: Lungos (Envivo and Fortissio)

Second ring: Ciocattino and older Brew Over Ice capsules (Leggero and Intenso?)

Third ring: Praline and 2016 Limited I believe.

Fourth ring: Peru Secreto and the 2014 vintage

Inner ring: a lone Paris Black.

https://preview.redd.it/geo9bngcnha51.jpg?width=2048&amp;format=pjpg&amp;auto=webp&amp;s=2b8c05910d175141b48aaaa9cded121892fe2f8bNew organization method for my Originaline capsules"
35,1,I just got my first Nespresso machine and theres so many amazing choices I’m not sure which ones to get. Any recommendations would be lovely thanks!,What’s your favourite Vertuo capsule?,I just got my first Nespresso machine and theres so many amazing choices I’m not sure which ones to get. Any recommendations would be lovely thanks!What’s your favourite Vertuo capsule?
36,1,"For camping and travelling purposes, would it be alright to leave an espresso machine in the back of a vehicle (pick up truck's floor behind driver seat)? Or would the extreme range of temps, from 0 Fahrenheit to summer heat(upper midwest) cause major damage to the machine?  And as for driving, how would you reduce the vibrations or would it make a difference to the internal components?",Leaving strapped nespresso in back of truck,"For camping and travelling purposes, would it be alright to leave an espresso machine in the back of a vehicle (pick up truck's floor behind driver seat)? Or would the extreme range of temps, from 0 Fahrenheit to summer heat(upper midwest) cause major damage to the machine?  And as for driving, how would you reduce the vibrations or would it make a difference to the internal components?Leaving strapped nespresso in back of truck"
37,1,,My wife got a new mug! Perfect for those 5 oz capsules.,My wife got a new mug! Perfect for those 5 oz capsules.
38,1,,First cold brew - Freddo Intenso. Thoughts?,First cold brew - Freddo Intenso. Thoughts?
39,1,,Hawaii Kona 2020 Special Reserve today and review link in comments section,Hawaii Kona 2020 Special Reserve today and review link in comments section
40,1,,"The cheapest 3rd party pod so far. About U$ 0.15 each, a quarter of an original Nespresso. Very good for a simple and non-pretentious cappuccino, it is the house brand of Dia supermarket and it is made in Spain.","The cheapest 3rd party pod so far. About U$ 0.15 each, a quarter of an original Nespresso. Very good for a simple and non-pretentious cappuccino, it is the house brand of Dia supermarket and it is made in Spain."
41,1,"Is it possible to pickup an online order at a boutique? My online order has taken forever to ship and we’re heading to a boutique today, so I was just wondering if we’d be able to pickup our machine there?",Order Pickup,"Is it possible to pickup an online order at a boutique? My online order has taken forever to ship and we’re heading to a boutique today, so I was just wondering if we’d be able to pickup our machine there?Order Pickup"
42,1,,"So we had a lot of trouble with 3 different machines and we settle for this. It's simple, but effective.","So we had a lot of trouble with 3 different machines and we settle for this. It's simple, but effective."
43,1,Is everyone else finding the website is down? Have.been trying to place an order for more than 6 hours and it has been down due to maintenance. Not sure if its just me or just the Australian site...,Website down?,Is everyone else finding the website is down? Have.been trying to place an order for more than 6 hours and it has been down due to maintenance. Not sure if its just me or just the Australian site...Website down?
44,1,,"If anyone wants to add a THEIR OWN MACHINE flair on their account, you can add it on the browser and not on the app. :) Just learned this a few days ago.","If anyone wants to add a THEIR OWN MACHINE flair on their account, you can add it on the browser and not on the app. :) Just learned this a few days ago."
45,1,"Just signed up for my machine plan, I wanna use the welcome gift, but don't wanna pay the extra to get 100 pods, since I only have $50 in my nespresso account right now. Is there a way to pay my next monthly payment sooner so I can have more credit on my account?",Machine Plan Question,"Just signed up for my machine plan, I wanna use the welcome gift, but don't wanna pay the extra to get 100 pods, since I only have $50 in my nespresso account right now. Is there a way to pay my next monthly payment sooner so I can have more credit on my account?Machine Plan Question"
46,1,,Unexpected purchase at my local Nespresso boutique,Unexpected purchase at my local Nespresso boutique
47,1,"Hi, so we just bought a brand new Creatista Plus today. Brilliant machine, makes excellent coffee. I've used it today to make four milk coffees in total. When taking out the used capsule bin at the end of the day, I noticed quite a bit of dirty (with coffee) water had accumulated inside the bin. Say about 20 mL. Is this normal or is there a problem with the machine? Thanks.",Creatista Plus: considerable amount of water in used capsule bin - normal?,"Hi, so we just bought a brand new Creatista Plus today. Brilliant machine, makes excellent coffee. I've used it today to make four milk coffees in total. When taking out the used capsule bin at the end of the day, I noticed quite a bit of dirty (with coffee) water had accumulated inside the bin. Say about 20 mL. Is this normal or is there a problem with the machine? Thanks.Creatista Plus: considerable amount of water in used capsule bin - normal?"
48,1,"Hello Everyone

, I just got my first nespresso (vertuo next) machine and I'm loving it! Since it's summer time I was wondering what are your go to Iced Coffee Recipes? I usually just go for the iced Forte or Iced Legerro with milk and call it a day.
But I'm sure theirs some other iced coffee recipes to really make it next level.
Thank you in advanced :)",Go to Iced Coffee Recipes?,"Hello Everyone

, I just got my first nespresso (vertuo next) machine and I'm loving it! Since it's summer time I was wondering what are your go to Iced Coffee Recipes? I usually just go for the iced Forte or Iced Legerro with milk and call it a day.
But I'm sure theirs some other iced coffee recipes to really make it next level.
Thank you in advanced :)Go to Iced Coffee Recipes?"
49,1,"Hello! I got an Essenza mini for university, and I was just wondering how size selection works for pods that can do both espresso and luongo (I got the Nicaragua ones) My parent’s vertuo machine won’t let you choose the size; it does it automatically based on the pod you put in. Is this also the case for original machines, or can you choose if the pod says it can do more than one size? Thanks in advance!! :)",How does size selection work?,"Hello! I got an Essenza mini for university, and I was just wondering how size selection works for pods that can do both espresso and luongo (I got the Nicaragua ones) My parent’s vertuo machine won’t let you choose the size; it does it automatically based on the pod you put in. Is this also the case for original machines, or can you choose if the pod says it can do more than one size? Thanks in advance!! :)How does size selection work?"
50,1,"Hey all
Does anyone have a good recommendation for syrups I could find in Mexico? I saw on amazon a DaVinci syrup but it seemed the bottle was too big and I haven’t tried it before to know if it’s good or not
Thanks!",Coffee syrup recommendation Mexico,"Hey all
Does anyone have a good recommendation for syrups I could find in Mexico? I saw on amazon a DaVinci syrup but it seemed the bottle was too big and I haven’t tried it before to know if it’s good or not
Thanks!Coffee syrup recommendation Mexico"
51,1,"Can't seem to get the milk settings down. I use whole milk, and fill up the pitcher to the line or below the line. After steaming, I will get the bubbles out and swirl the pitcher. However when attempting to do latte art, I can't get the contrast until the end, and when it starts, the foam comes out very thick. Thoughts?",Steaming Milk with Creatista Plus,"Can't seem to get the milk settings down. I use whole milk, and fill up the pitcher to the line or below the line. After steaming, I will get the bubbles out and swirl the pitcher. However when attempting to do latte art, I can't get the contrast until the end, and when it starts, the foam comes out very thick. Thoughts?Steaming Milk with Creatista Plus"
52,1,,Join our new Facebook selling group. Exclusive Discounts updated regularly!,Join our new Facebook selling group. Exclusive Discounts updated regularly!
