,subreddit,selftext,title,posts
62,1,,"Snowball recriation: for those who miss one of last year's LE Variations Confetto, you can have a similar result with a pump (5 ml) of Monin Coconut syrup and an espresso brew made with Vanillio. No extra sugar needed. It tastes delicious as a cappuccino, as well.","Snowball recriation: for those who miss one of last year's LE Variations Confetto, you can have a similar result with a pump (5 ml) of Monin Coconut syrup and an espresso brew made with Vanillio. No extra sugar needed. It tastes delicious as a cappuccino, as well."
63,1,,Aurora de la Paz and Paris Black now available! (USA),Aurora de la Paz and Paris Black now available! (USA)
64,1,"Noticed that today's year end promotion is up... but it is less beneficial than it usually is for anyone buying a milk machine (at least in the UK).

Buy any machine, get up to 150 capsules!
- 150 capsules for any Original line
- 120 capsules for any Vertuo line
- ""Free"" Travel Mug when you buy 100 capsules before 31st March 2019

However, some things to note;
- Vertuo line has been on offer for a while; back to full price
- Capsules pre-selected by Nespresso staff; you don't get to pick
- Capsules ""worth £50"" (meaning no more £75 for a milk machine)
",Nespresso Year End Promotion,"Noticed that today's year end promotion is up... but it is less beneficial than it usually is for anyone buying a milk machine (at least in the UK).

Buy any machine, get up to 150 capsules!
- 150 capsules for any Original line
- 120 capsules for any Vertuo line
- ""Free"" Travel Mug when you buy 100 capsules before 31st March 2019

However, some things to note;
- Vertuo line has been on offer for a while; back to full price
- Capsules pre-selected by Nespresso staff; you don't get to pick
- Capsules ""worth £50"" (meaning no more £75 for a milk machine)
Nespresso Year End Promotion"
65,1,https://youtu.be/Kc0dTJYA6z0,TIL If you press and hold the button while your coffee pours... it doesn’t stop until you let go. It then saves that setting for how much coffee to pour.,https://youtu.be/Kc0dTJYA6z0TIL If you press and hold the button while your coffee pours... it doesn’t stop until you let go. It then saves that setting for how much coffee to pour.
66,1,"Newbie here: a few days ago, my machine pretty much stopped “with the crema”. I have a new Citiz, I descaled it - no luck. 

Am I going anything wrong, or is it time to go to the boutique with my warranty card?

Thank you in advance!",No more crema?,"Newbie here: a few days ago, my machine pretty much stopped “with the crema”. I have a new Citiz, I descaled it - no luck. 

Am I going anything wrong, or is it time to go to the boutique with my warranty card?

Thank you in advance!No more crema?"
67,1,,What are the Special Reserve capsules?,What are the Special Reserve capsules?
68,1,,"The more than satisfying unboxing. The book was the item I was expecting the most, but it just text and pictures from the site. Tasting notes will follow next week...","The more than satisfying unboxing. The book was the item I was expecting the most, but it just text and pictures from the site. Tasting notes will follow next week..."
69,1,"I work in an office setting - rows of long desks where people sit side by side with no cubicle walls.  Ambient noise consists mostly of people talking on the phone at moderate levels. 

I was thinking about bringing my Nespresso Innisia in to work and leaving it on my desk - I have plenty of room for it, but I was a little bit concerned about noise while the machine operates. 

I’d probably use it 2-3 times a day. What do you think?   Is this rude/distracting?",Nespresso at Work Desk,"I work in an office setting - rows of long desks where people sit side by side with no cubicle walls.  Ambient noise consists mostly of people talking on the phone at moderate levels. 

I was thinking about bringing my Nespresso Innisia in to work and leaving it on my desk - I have plenty of room for it, but I was a little bit concerned about noise while the machine operates. 

I’d probably use it 2-3 times a day. What do you think?   Is this rude/distracting?Nespresso at Work Desk"
70,1,,"Italians name it Marocchino. I name it ""Triple mocha"": chocolate sauce, steamed milk, one pod ciocattino as espresso, cocoa powder. Perfect to end my slow sunday breakfast.","Italians name it Marocchino. I name it ""Triple mocha"": chocolate sauce, steamed milk, one pod ciocattino as espresso, cocoa powder. Perfect to end my slow sunday breakfast."
71,1,"I only saw one brief note on this, so I figured I would ask...

Which of the Target-sold capsules can be recycled with standard Nespresso recycling? I heard that the Peet's capsules are full aluminum, and I'm willing to pay more for the ability to easily recycle, but I wanted to check before buying.

Are the Archer Farms capsules recyclable only if torn open (like Keurig)? (We have been pleasantly surprised by the Archer Farms brand, but not enough to create additional non-recyclable waste).

Thanks!

",Target Capsules - Recycling?,"I only saw one brief note on this, so I figured I would ask...

Which of the Target-sold capsules can be recycled with standard Nespresso recycling? I heard that the Peet's capsules are full aluminum, and I'm willing to pay more for the ability to easily recycle, but I wanted to check before buying.

Are the Archer Farms capsules recyclable only if torn open (like Keurig)? (We have been pleasantly surprised by the Archer Farms brand, but not enough to create additional non-recyclable waste).

Thanks!

Target Capsules - Recycling?"
72,1,,Interrupted Water Flow,Interrupted Water Flow
73,1,,Found these at local grocery store called HEB in Texas. They were $4 per box,Found these at local grocery store called HEB in Texas. They were $4 per box
74,1,,Is there a forum or a place where I can buy and sell old editions?,Is there a forum or a place where I can buy and sell old editions?
75,1,,"Anyone else keeps one pod of each, retired or limited editions, swearing that will never brew, just collect them?","Anyone else keeps one pod of each, retired or limited editions, swearing that will never brew, just collect them?"
76,1,,"Trying something new (for me), it was same price point as Nespresso pods.","Trying something new (for me), it was same price point as Nespresso pods."
77,1,,"Late night treat: 2 pumps of cookie syrup, steamed milk, Arpeggio decaf brewed as lungo, cookie grounds for decoration. What's yours?","Late night treat: 2 pumps of cookie syrup, steamed milk, Arpeggio decaf brewed as lungo, cookie grounds for decoration. What's yours?"
78,1,What would be the closest Original line coffee? Anyone knwo?,Diavolito equivalent,What would be the closest Original line coffee? Anyone knwo?Diavolito equivalent
79,1,"Why can't we buy them separately? I don't give a damn about the glasses and the book.

https://www.nespresso.com/ca/en/order/capsules/original/explorations-2018-coffee-assortment-fr
",(Canada) Exploration 2018,"Why can't we buy them separately? I don't give a damn about the glasses and the book.

https://www.nespresso.com/ca/en/order/capsules/original/explorations-2018-coffee-assortment-fr
(Canada) Exploration 2018"
80,1,,Thought you all would enjoy this!,Thought you all would enjoy this!
81,1,"I've been looking for a personal coffee machine to bring to the office since my current options are go out to stores to pay for it, or some really abysmal drip coffee. At home I have a Breville Barista Express and 99% of what I make with it americanos so I'm leaning towards something that can do something similar.

I've been trying to do some research on various machines on offer, and have seen (online) the vertuoplus &amp; vertuoplus deluxe models on offer (in Canada). The idea of the option between espresso and coffee sounds good, but I'm not sure how well it works in practice. I've also seen some issues described about them with them having leaking problems, but that doesn't seem to be mentioned too often. Then there are the Inissia and Citiz models, but it's difficult to differentiate between some of the machines and their functions.

Without spending an arm and a leg is there a machine that does the espresso thing well (I've read it's not exactly espresso) and that can add additional hot water? Also for the people that do lungos how well do they come out with that extra brew water vs just plain hot water for an americano (if that's an option)?

Thanks
Thanks",Best Choice for an Americano Equivalent?,"I've been looking for a personal coffee machine to bring to the office since my current options are go out to stores to pay for it, or some really abysmal drip coffee. At home I have a Breville Barista Express and 99% of what I make with it americanos so I'm leaning towards something that can do something similar.

I've been trying to do some research on various machines on offer, and have seen (online) the vertuoplus &amp; vertuoplus deluxe models on offer (in Canada). The idea of the option between espresso and coffee sounds good, but I'm not sure how well it works in practice. I've also seen some issues described about them with them having leaking problems, but that doesn't seem to be mentioned too often. Then there are the Inissia and Citiz models, but it's difficult to differentiate between some of the machines and their functions.

Without spending an arm and a leg is there a machine that does the espresso thing well (I've read it's not exactly espresso) and that can add additional hot water? Also for the people that do lungos how well do they come out with that extra brew water vs just plain hot water for an americano (if that's an option)?

Thanks
ThanksBest Choice for an Americano Equivalent?"
82,1,It seems the original line machines are where all the fun is... is that true? Verto doesn’t seem to get the special flavors etc.,Verto line not seeing the fun stuff,It seems the original line machines are where all the fun is... is that true? Verto doesn’t seem to get the special flavors etc.Verto line not seeing the fun stuff
83,1,"Hi All,

&amp;#x200B;

This is my first post here! My girlfriend and I are looking for a new Nespresso machine and are having a hard time deciding. Currently we are torn between the Expert &amp; Milk or the Lattissma Pro. Personally, I stick to americano whereas my girlfriend prefers Latte etc. I was heading towards the Expert but have seen some bad reviews on Amazon/ Youtube and not too sure about the separate milk frother. Does anyone here have experience with either machine? Curious to know how easy it is to make americano's on the Lattissma Pro and how the auto cleaning function works.

&amp;#x200B;

Any advice is appreciated!!

&amp;#x200B;

Thanks,",Help us decide!,"Hi All,

&amp;#x200B;

This is my first post here! My girlfriend and I are looking for a new Nespresso machine and are having a hard time deciding. Currently we are torn between the Expert &amp; Milk or the Lattissma Pro. Personally, I stick to americano whereas my girlfriend prefers Latte etc. I was heading towards the Expert but have seen some bad reviews on Amazon/ Youtube and not too sure about the separate milk frother. Does anyone here have experience with either machine? Curious to know how easy it is to make americano's on the Lattissma Pro and how the auto cleaning function works.

&amp;#x200B;

Any advice is appreciated!!

&amp;#x200B;

Thanks,Help us decide!"
84,1,"I always rinse the frother after each use and the body of the frother itself is spotless, but I've had it for about two years now and there is some rust, burnt protein and/or discoloration on the metal spiral heating element thingy. Hot water and soap isn't working so is there a more effective way to clean it? Like using degreaser or vinegar or something?

Thanks for your time.",How to clean the heating element in the Aeroccino frother?,"I always rinse the frother after each use and the body of the frother itself is spotless, but I've had it for about two years now and there is some rust, burnt protein and/or discoloration on the metal spiral heating element thingy. Hot water and soap isn't working so is there a more effective way to clean it? Like using degreaser or vinegar or something?

Thanks for your time.How to clean the heating element in the Aeroccino frother?"
85,1,"Hey all. I got a Vertuoline machine a few weeks ago and keep it on my desk at work. Been completely obsessed with it and sit here making double shots all day. I decided to pick up an Orginal line Inissia - I bought it ""Unopened"" from a guy on OfferUp and indeed, it appeared unopened and unused. But every shot I make in the Inissia, from the included sampler pack to the archer farms/peet's pods I bought, taste underextracted, and in some cases very sour. Doesn't even come close to the awesome shots I'm getting from my VertuoLine. Am I doing something wrong? It seems to me that any time I've made sour coffee, it was because the water wasn't hot enough... but I'm not sure that is the case here. Just really disappointed, and because I bought it on OfferUp, I can't exchange it for another VertuoLine","Love my VertuoLine, disappointed with Inissia. Machine issue?","Hey all. I got a Vertuoline machine a few weeks ago and keep it on my desk at work. Been completely obsessed with it and sit here making double shots all day. I decided to pick up an Orginal line Inissia - I bought it ""Unopened"" from a guy on OfferUp and indeed, it appeared unopened and unused. But every shot I make in the Inissia, from the included sampler pack to the archer farms/peet's pods I bought, taste underextracted, and in some cases very sour. Doesn't even come close to the awesome shots I'm getting from my VertuoLine. Am I doing something wrong? It seems to me that any time I've made sour coffee, it was because the water wasn't hot enough... but I'm not sure that is the case here. Just really disappointed, and because I bought it on OfferUp, I can't exchange it for another VertuoLineLove my VertuoLine, disappointed with Inissia. Machine issue?"
86,1,,"Compatible capsules from ""Carracci"". Anybody knows more about this company?","Compatible capsules from ""Carracci"". Anybody knows more about this company?"
87,1,"My Nespresso Inissia D40 machine is blinking alternately and keeps pouring water as soon as I put into the electric plug, what do I do",Cant fix my nespresso machine!,"My Nespresso Inissia D40 machine is blinking alternately and keeps pouring water as soon as I put into the electric plug, what do I doCant fix my nespresso machine!"
88,1,"Hi, does anybody know, if you order between 1000 and 1500 capsules in a year you’re account gets more benefits and you become an ‘Expert’. If I drink over 1000 capsules one year does it reset the next or does that mean I have Expert Membership Status. Thanks for your help. 

Ps: I’m sure this applies to ambassador status but I’m not sure how likely I’ll get to over 1.5k capsules. ",Nespresso and You: Expert,"Hi, does anybody know, if you order between 1000 and 1500 capsules in a year you’re account gets more benefits and you become an ‘Expert’. If I drink over 1000 capsules one year does it reset the next or does that mean I have Expert Membership Status. Thanks for your help. 

Ps: I’m sure this applies to ambassador status but I’m not sure how likely I’ll get to over 1.5k capsules. Nespresso and You: Expert"
89,1,,Nicaragua Las Marias Estate intensity chart,Nicaragua Las Marias Estate intensity chart
90,1,,India Mylemoney Estate intensity chart.,India Mylemoney Estate intensity chart.
91,1,,Dominican Republic Valle del Cibao intensity chart.,Dominican Republic Valle del Cibao intensity chart.
92,1,,Galapagos Santa Cruz intensity chart.,Galapagos Santa Cruz intensity chart.
93,1,https://youtu.be/uQClKTtNXdA,Christmas arriving earlier.,https://youtu.be/uQClKTtNXdAChristmas arriving earlier.
94,1,"Hi, first time pod user here. I used to drink the Nescafe sachets but recently switched to the pods because my college has a machine. I got the box of 16 Cappuccino pods and although some of them have worked fine, a few have just given me hot milk. Is it possible that I've gotten a faulty batch or am I supposed to combine one milk pod with one coffee pod? If so, how do I tell the difference? They all look the same as far as I can tell. Thanks.",Cappuccino Pods Only Dispensing Milk,"Hi, first time pod user here. I used to drink the Nescafe sachets but recently switched to the pods because my college has a machine. I got the box of 16 Cappuccino pods and although some of them have worked fine, a few have just given me hot milk. Is it possible that I've gotten a faulty batch or am I supposed to combine one milk pod with one coffee pod? If so, how do I tell the difference? They all look the same as far as I can tell. Thanks.Cappuccino Pods Only Dispensing Milk"
95,1,,"Excuse my one hand crappy video recording skills, but I wanted to share this with my fellow Nespresso drinkers. We got his beautiful machine for $150 one year ago and we love it.","Excuse my one hand crappy video recording skills, but I wanted to share this with my fellow Nespresso drinkers. We got his beautiful machine for $150 one year ago and we love it."
96,1,,"Getting some work done, needed a little boost! Arpeggio ( my go to)","Getting some work done, needed a little boost! Arpeggio ( my go to)"
97,1,,My favorite recipe for a sunday breakfast: double milk latté with Kazaar. What's yours favorite?,My favorite recipe for a sunday breakfast: double milk latté with Kazaar. What's yours favorite?
98,1,,UK Nespresso Compatible Advent Calendar for two,UK Nespresso Compatible Advent Calendar for two
99,1,"One week ago i brought the Expert &amp; milk on special for $199 (down from $599 Australian) 

As a law student I drink ALOT of coffee (especilly this time of semester with 2 weeks to go) and i'm pretty anal about my coffee.

I have to say i love my machine. I mostly drink Livanto but the Caramelito is a great change. 

I love the bluetooth capability - ill leave a pod in and a cup ready to go so when i want a coffee i'll walk into the kitchen and on the way i'll hit the brew button. 

not having an automilk dispenser is a downer, but i can understand why.

I used some third party pods today and they were a hastle - they did not pierce properly, making my machine think i was out of milk. i had to factory reset it so i'll stick with nespresso pods from now on.

all in all a good experiance and i'll be drinking more nespresso coffee",a one week review,"One week ago i brought the Expert &amp; milk on special for $199 (down from $599 Australian) 

As a law student I drink ALOT of coffee (especilly this time of semester with 2 weeks to go) and i'm pretty anal about my coffee.

I have to say i love my machine. I mostly drink Livanto but the Caramelito is a great change. 

I love the bluetooth capability - ill leave a pod in and a cup ready to go so when i want a coffee i'll walk into the kitchen and on the way i'll hit the brew button. 

not having an automilk dispenser is a downer, but i can understand why.

I used some third party pods today and they were a hastle - they did not pierce properly, making my machine think i was out of milk. i had to factory reset it so i'll stick with nespresso pods from now on.

all in all a good experiance and i'll be drinking more nespresso coffeea one week review"
0,1,"Hi all,

I've decided to create a thread to compile a list of all active deals for Nespresso -- site coupons, machine sales, etc. I think we should limit this to Nespresso and their retail partners just to prevent junk like random Ebay deals or sketchy Amazon sellers cluttering up the thread.

I know in the past it's been pretty hit or miss as to whether or not Nespresso actually e-mails you about active promotions. This way people can be aware of every deal that's currently available, even if they weren't targeted by the marketing campaign.

I'd like new people to be able to come here to find a good deal on their first machine, or for current Nespresso owners to find a coupon code to use when re-ordering capsules.

I will keep this updated with any deals that I receive, but please share anything you know of if it's not already listed. Be sure to specify your region because any promotions will be region specific, and also provide the time frame that the deal is active (usually located in the fine print of any e-mails). If a deal has expired, let me know and I will remove it.

Thanks!

***

| Nespresso.com Promotion | Code | Region | Expiration |
|:--|:--|:--:|:--:|
| 2 Pure Mugs with purchase of 15+ sleeves | OCTOBER2018 | USA | 10/16/2018 |
| Box of chocolates with purchase of 10+ sleeves | CHOCO2018 | USA | 10/16/2018 |

| Item | Retailer | Price | Region | Expiration |
|:--|:--|:--:|:--:|:--:|
| VertuoPlus Deluxe and $20 coffee credit | Williams-Sonoma | [$99.95](https://www.williams-sonoma.com/products/nespresso-vertuoplus-deluxe-espresso-machine-with-coffee-offer/?pkey=e%7Cnespresso%7C62%7Cbest%7C0%7C1%7C24%7C%7C23&amp;cm_src=PRODUCTSEARCH) | USA | Unknown |",Current Deals Megathread,"Hi all,

I've decided to create a thread to compile a list of all active deals for Nespresso -- site coupons, machine sales, etc. I think we should limit this to Nespresso and their retail partners just to prevent junk like random Ebay deals or sketchy Amazon sellers cluttering up the thread.

I know in the past it's been pretty hit or miss as to whether or not Nespresso actually e-mails you about active promotions. This way people can be aware of every deal that's currently available, even if they weren't targeted by the marketing campaign.

I'd like new people to be able to come here to find a good deal on their first machine, or for current Nespresso owners to find a coupon code to use when re-ordering capsules.

I will keep this updated with any deals that I receive, but please share anything you know of if it's not already listed. Be sure to specify your region because any promotions will be region specific, and also provide the time frame that the deal is active (usually located in the fine print of any e-mails). If a deal has expired, let me know and I will remove it.

Thanks!

***

| Nespresso.com Promotion | Code | Region | Expiration |
|:--|:--|:--:|:--:|
| 2 Pure Mugs with purchase of 15+ sleeves | OCTOBER2018 | USA | 10/16/2018 |
| Box of chocolates with purchase of 10+ sleeves | CHOCO2018 | USA | 10/16/2018 |

| Item | Retailer | Price | Region | Expiration |
|:--|:--|:--:|:--:|:--:|
| VertuoPlus Deluxe and $20 coffee credit | Williams-Sonoma | [$99.95](https://www.williams-sonoma.com/products/nespresso-vertuoplus-deluxe-espresso-machine-with-coffee-offer/?pkey=e%7Cnespresso%7C62%7Cbest%7C0%7C1%7C24%7C%7C23&amp;cm_src=PRODUCTSEARCH) | USA | Unknown |Current Deals Megathread"
