,subreddit,selftext,title,posts
2,0,"I was using this 6s phone for past 2.5 years and today I went to apple store for battery replacement.  Apparently one of the technicians made some mistake in replacing the battery and Apple gave me a brand new 6S phone.

Apple's commitment towards customer satisfaction is commendable 

PS: I took a backup on iTunes before going in for battery replacement.",Apple is so customer friendly,"I was using this 6s phone for past 2.5 years and today I went to apple store for battery replacement.  Apparently one of the technicians made some mistake in replacing the battery and Apple gave me a brand new 6S phone.

Apple's commitment towards customer satisfaction is commendable 

PS: I took a backup on iTunes before going in for battery replacement.Apple is so customer friendly"
3,0,"Hear me out, in my mind I wouldn’t see how this wouldn’t work, or at least work a little bit. 

So, on my old monitor, with my graphics card software, I could manually overclock the factory 60Hz refresh rate to 75Hz and this made my games MUCH smoother and visually appealing. 

Now for the phones, with root access, via a jailbreak for example, would this overclock of the screen’s refresh rate not be potentially possible? Even by a little? 

I am aware the overclocking of the monitors refresh rate may shorten its life span, but who keeps technology that long anyways, thoughts on this?
 ",[ProMotion Possible on Current Phones] quick question and discussion.,"Hear me out, in my mind I wouldn’t see how this wouldn’t work, or at least work a little bit. 

So, on my old monitor, with my graphics card software, I could manually overclock the factory 60Hz refresh rate to 75Hz and this made my games MUCH smoother and visually appealing. 

Now for the phones, with root access, via a jailbreak for example, would this overclock of the screen’s refresh rate not be potentially possible? Even by a little? 

I am aware the overclocking of the monitors refresh rate may shorten its life span, but who keeps technology that long anyways, thoughts on this?
 [ProMotion Possible on Current Phones] quick question and discussion."
4,0,,First iPad! 6th Gen. I think I did good,First iPad! 6th Gen. I think I did good
5,0,"They’re website says that Jump does not accept opened Apple watches back I read that Apple accepts them back after two weeks if not damaged so I opened it and after opening it and using it for a little while it does not seem worth the price tag at all but I can’t return it to where I bought it so is there anything else that I can do with it?

(Sorry for formatting/ grammar using mobile)",Returning an opened Apple Watch to jump plus,"They’re website says that Jump does not accept opened Apple watches back I read that Apple accepts them back after two weeks if not damaged so I opened it and after opening it and using it for a little while it does not seem worth the price tag at all but I can’t return it to where I bought it so is there anything else that I can do with it?

(Sorry for formatting/ grammar using mobile)Returning an opened Apple Watch to jump plus"
6,0,[removed],Messages Bug,[removed]Messages Bug
7,0,,How do I tell the difference between the IPhone X and the IPhone XS?,How do I tell the difference between the IPhone X and the IPhone XS?
8,0,,I’ll go first: “Don’t tease me in the morning.”,I’ll go first: “Don’t tease me in the morning.”
9,0,If not could someone be generous enough to do it for me I would very much appreciate it.,Is there a place where I can get the new IPad wallpapers formatted for my iPhone X?,If not could someone be generous enough to do it for me I would very much appreciate it.Is there a place where I can get the new IPad wallpapers formatted for my iPhone X?
10,0,"so a few weeks ago i bought a clear case from apple, and a guy from the store put it in for me but it was really hard to get off, there was an air bubble which bothered me and i somehow got it off and now there is scuffs, dust and water? i think in my case and even if i take it off and clean it, it shows up a couple days later, and this case is a huge fingerprint magnet. has anyone had these problems or is it just me? ",Iphone xr clear case problems?,"so a few weeks ago i bought a clear case from apple, and a guy from the store put it in for me but it was really hard to get off, there was an air bubble which bothered me and i somehow got it off and now there is scuffs, dust and water? i think in my case and even if i take it off and clean it, it shows up a couple days later, and this case is a huge fingerprint magnet. has anyone had these problems or is it just me? Iphone xr clear case problems?"
11,0,"here’s the solution, if audio out of the charging port is better then just add a second charging port so that people can charge their phone while using headphones. it’s not a foolproof solution but it’s better than what’s already out there",a solution to the headphone port,"here’s the solution, if audio out of the charging port is better then just add a second charging port so that people can charge their phone while using headphones. it’s not a foolproof solution but it’s better than what’s already out therea solution to the headphone port"
12,0,,beat #367hot shit,beat #367hot shit
13,0,"**Mods please don’t remove this post, I’ve already left feedback for the developers on multiple occasions and nothing has changed. The only way for this issue to get fixed is to bring attention to the public**

Basically, if you have Bluetooth headphones or AirPods, you will experience frame drops if you’re connected to them while watching a video. This is a problem within iOS itself, as I’ve tried multiple different phones, different headphones and different iOS versions. (It’s also iOS wide, not linked to the YouTube app specifically.) I hope the developers of iOS can come to attention about this issue and fix it ASAP as it very much degrades the apple experience. 


Here are steps to reproduce this issue very easily: 

1) Download the YouTube app if you do not have it
2) Disconnect bluetooth
3) Watch a video that has 60 FPS, I suggest a video on a video game. [This video is the best way to produce this issue.](https://youtu.be/eoGx5GRbSfM) (make sure to open the video in the YouTube app) 
4) Watch the video (make sure highest quality possible) for a bit, you can skip around. Take note of how smooth it is
5) connect your Bluetooth headphones and unpause the video, you should be able to instantly see the frame loss
6) if you still can’t tell, watch the video with your Bluetooth headphones, skip around and then turn them off and unpause the video, you will see the video has become much more smooth. 


If you experience this issue on your iPhone, or other iOS device, I urge you to send feedback with the rest of us as I believe that will be the only way we can get the developers to notice. 

You can send feedback [here.](https://www.apple.com/feedback/iphone.html)
Below I will create a template you can use for the comment section in the feedback, feel free to change it if you’d like. 

____________________________________________
Subject: Bluetooth video frame loss 

Feedback type: Performance 

Comments: 

Whenever you connect a Bluetooth audio device to your iOS device, you will experience a frameloss up to it seems 30 frames. 

Example: If you’re watching a video (especially a video game gameplay) with the iPhone’s speakers you will experience it in a smooth 60 frames. However,  when you connect your Bluetooth device (headphones for example), you will notice significant lag and frame drop in the video. 

Steps to reproduce: 
1) Watch video gameplay on YouTube app in 60 FPS
2) connect Bluetooth headphones after a while and you will see reduced frames, which degrades the user experience greatly. 

Thank you, I hope you can fix this bug quickly. 
__________________________________________



Thanks for reading and if you can reproduce this issue, please comment below.  
",This bluetooth lag issue REALLY needs more attention.,"**Mods please don’t remove this post, I’ve already left feedback for the developers on multiple occasions and nothing has changed. The only way for this issue to get fixed is to bring attention to the public**

Basically, if you have Bluetooth headphones or AirPods, you will experience frame drops if you’re connected to them while watching a video. This is a problem within iOS itself, as I’ve tried multiple different phones, different headphones and different iOS versions. (It’s also iOS wide, not linked to the YouTube app specifically.) I hope the developers of iOS can come to attention about this issue and fix it ASAP as it very much degrades the apple experience. 


Here are steps to reproduce this issue very easily: 

1) Download the YouTube app if you do not have it
2) Disconnect bluetooth
3) Watch a video that has 60 FPS, I suggest a video on a video game. [This video is the best way to produce this issue.](https://youtu.be/eoGx5GRbSfM) (make sure to open the video in the YouTube app) 
4) Watch the video (make sure highest quality possible) for a bit, you can skip around. Take note of how smooth it is
5) connect your Bluetooth headphones and unpause the video, you should be able to instantly see the frame loss
6) if you still can’t tell, watch the video with your Bluetooth headphones, skip around and then turn them off and unpause the video, you will see the video has become much more smooth. 


If you experience this issue on your iPhone, or other iOS device, I urge you to send feedback with the rest of us as I believe that will be the only way we can get the developers to notice. 

You can send feedback [here.](https://www.apple.com/feedback/iphone.html)
Below I will create a template you can use for the comment section in the feedback, feel free to change it if you’d like. 

____________________________________________
Subject: Bluetooth video frame loss 

Feedback type: Performance 

Comments: 

Whenever you connect a Bluetooth audio device to your iOS device, you will experience a frameloss up to it seems 30 frames. 

Example: If you’re watching a video (especially a video game gameplay) with the iPhone’s speakers you will experience it in a smooth 60 frames. However,  when you connect your Bluetooth device (headphones for example), you will notice significant lag and frame drop in the video. 

Steps to reproduce: 
1) Watch video gameplay on YouTube app in 60 FPS
2) connect Bluetooth headphones after a while and you will see reduced frames, which degrades the user experience greatly. 

Thank you, I hope you can fix this bug quickly. 
__________________________________________



Thanks for reading and if you can reproduce this issue, please comment below.  
This bluetooth lag issue REALLY needs more attention."
14,0,"Just downloaded iTunes, its been a while since I have used it. I have a whole archive of FLAC music and want a visually appealing player. Does iTunes support FLAC?",Does iTunes play FLAC files?,"Just downloaded iTunes, its been a while since I have used it. I have a whole archive of FLAC music and want a visually appealing player. Does iTunes support FLAC?Does iTunes play FLAC files?"
15,0,[removed],LEAKED IPAD MINI 5 CASE,[removed]LEAKED IPAD MINI 5 CASE
16,0,[removed],safe to charge airpods w silicone case?,[removed]safe to charge airpods w silicone case?
17,0,"Anyone know a way to zoom the content in mail? I don't mean the font size I just mean make everything larger as I find it quite small.

I don't need it zoomed for the whole system just mail. Thanks :) ",Zoom Mail on Mac,"Anyone know a way to zoom the content in mail? I don't mean the font size I just mean make everything larger as I find it quite small.

I don't need it zoomed for the whole system just mail. Thanks :) Zoom Mail on Mac"
18,0,,How to fix?,How to fix?
19,0,,“iPhone 'X' names have nowhere to go in 2019” -CNET,“iPhone 'X' names have nowhere to go in 2019” -CNET
20,0,[removed],My iTunes doesn’t recognize my iPhone 7. Could someone help me out?,[removed]My iTunes doesn’t recognize my iPhone 7. Could someone help me out?
21,0,,What are the Common MacBook Problems?,What are the Common MacBook Problems?
22,0,[removed],"My mom changed her phone number, but forgot to change her Apple ID trusted number. She now forgot her password. What's the best solution?","[removed]My mom changed her phone number, but forgot to change her Apple ID trusted number. She now forgot her password. What's the best solution?"
23,0,Since Photoshop not Illustrator (for the iPad) don’t have the pen tool. I don’t think Procreate has it either. Thank you!,Is there any iPad drawing app that has a pen tool similar to Adobe Illustrator’s?,Since Photoshop not Illustrator (for the iPad) don’t have the pen tool. I don’t think Procreate has it either. Thank you!Is there any iPad drawing app that has a pen tool similar to Adobe Illustrator’s?
24,0,,can i get some help whit this?,can i get some help whit this?
25,0,[removed],Is there any iPad app that has a pen tool? Similar to Illustrator’s pen tool. Thanks!,[removed]Is there any iPad app that has a pen tool? Similar to Illustrator’s pen tool. Thanks!
26,0,,cna i get some help whit this?,cna i get some help whit this?
27,0,[removed],Need help replacing an iPhone XS,[removed]Need help replacing an iPhone XS
28,0,,Dang iPod touch running iOS 10.3.3,Dang iPod touch running iOS 10.3.3
29,0,[removed],Fast Charge 2018 iPad Pro?,[removed]Fast Charge 2018 iPad Pro?
30,0,"Hear me out. I know they exist, fanboys exist in every category but I’ve watched primary tech related youtubers for a while now (years) and on every android video I see comments like “I’m an iPhone / Apple user and this looks great” or “this is what Apple needs”. Whereas in the comments of Apple videos all I see is vile being thrown around. 

It just comes off as one side constantly trying to pick a fight with the other side that didn’t even ask for it.

Am I wrong? ",I rarely see Apple fanboys 🤔,"Hear me out. I know they exist, fanboys exist in every category but I’ve watched primary tech related youtubers for a while now (years) and on every android video I see comments like “I’m an iPhone / Apple user and this looks great” or “this is what Apple needs”. Whereas in the comments of Apple videos all I see is vile being thrown around. 

It just comes off as one side constantly trying to pick a fight with the other side that didn’t even ask for it.

Am I wrong? I rarely see Apple fanboys 🤔"
31,0,[removed],I bought my iPhone X a month ago and my battery capacity is at 98% is that normal?,[removed]I bought my iPhone X a month ago and my battery capacity is at 98% is that normal?
32,0,[removed],Need help exchanging,[removed]Need help exchanging
33,0,[removed],What should I do after noticing water damage after scheduling an appointment,[removed]What should I do after noticing water damage after scheduling an appointment
34,0,"I just didn't like that notch, I just don't. ¯\\\_(ツ)_/¯","I skipped the iPhone X, XS and XR","I just didn't like that notch, I just don't. ¯\\\_(ツ)_/¯I skipped the iPhone X, XS and XR"
35,0,[removed],iTunes library upgrade,[removed]iTunes library upgrade
36,0,,"Flashback Review: Apple iPod Socks, 2004","Flashback Review: Apple iPod Socks, 2004"
37,0,,The iPad still doesn’t support the calculator app. Even with scaling 🤦‍♂️. I would use it with scaling if they offered the option because most calculator apps for iPad either cost money or are bloated with ads.,The iPad still doesn’t support the calculator app. Even with scaling 🤦‍♂️. I would use it with scaling if they offered the option because most calculator apps for iPad either cost money or are bloated with ads.
38,0,[removed],iOS should have an option that gives to the user the possibility of deciding in which photo album to save an image that could be a screenshot or from any the internet.,[removed]iOS should have an option that gives to the user the possibility of deciding in which photo album to save an image that could be a screenshot or from any the internet.
39,0,"I'm just gonna rant a little but APPLE what is UP with that arbitrary 50000 rule adblock limit? As a (semi)power user coming from uBlock Origin it's really limiting and really annoying. I now have to use two apps to do what uBlock0 did easily and the primary one (Wipr) has to use a workaround to fit in all of its filter rules. I struggle to get all of the lists I want active because of this arbitrary rule (excessive? perhaps a bit) and continually have to choose between lists to enable in AdGuard to satisfy this limit. I highly dislike this limit, what about you guys? Also, do you guys have any explanation for this limit?",Random limit on adblock filter lists is annoying,"I'm just gonna rant a little but APPLE what is UP with that arbitrary 50000 rule adblock limit? As a (semi)power user coming from uBlock Origin it's really limiting and really annoying. I now have to use two apps to do what uBlock0 did easily and the primary one (Wipr) has to use a workaround to fit in all of its filter rules. I struggle to get all of the lists I want active because of this arbitrary rule (excessive? perhaps a bit) and continually have to choose between lists to enable in AdGuard to satisfy this limit. I highly dislike this limit, what about you guys? Also, do you guys have any explanation for this limit?Random limit on adblock filter lists is annoying"
40,0,"I'm listening to the same song on iTunes, on the same Bluetooth headset on my mac that I just was on my iPhone and it sounds better. Is it just me, or does the mac output better sound?","Is it just me, or does my MacBook output better sound than my iPhone?","I'm listening to the same song on iTunes, on the same Bluetooth headset on my mac that I just was on my iPhone and it sounds better. Is it just me, or does the mac output better sound?Is it just me, or does my MacBook output better sound than my iPhone?"
41,0,"Didn’t there used to be a “new games we like” section in appstore? How do I see the new releases now? All I see are the popular games or games with recent updates, neither of which are actually new releases.",New games section in Appstore?,"Didn’t there used to be a “new games we like” section in appstore? How do I see the new releases now? All I see are the popular games or games with recent updates, neither of which are actually new releases.New games section in Appstore?"
42,0,[removed],iOS should have an option that gives to the user the possibility of deciding in which photo album to save an image that could be a screenshot or from any the internet.,[removed]iOS should have an option that gives to the user the possibility of deciding in which photo album to save an image that could be a screenshot or from any the internet.
43,0,[removed],Problem with YouTube and AirPods,[removed]Problem with YouTube and AirPods
44,0,"I'm somewhat confused on what is the supposed way of using the photos app. On Google Photos it was clear that you were not supposed to put other images downloaded from other places (drawings, memes, etc) or screenshots but on iOS everything is saved to photos by default instead of files, but on macOS screenshots end up in the desktop (iCloud Drive) and downloaded images end up on the download folder which isn't backed up to iCloud.

How do you guys use the Photos app?",Photos just to save photos or to save any kind of image?,"I'm somewhat confused on what is the supposed way of using the photos app. On Google Photos it was clear that you were not supposed to put other images downloaded from other places (drawings, memes, etc) or screenshots but on iOS everything is saved to photos by default instead of files, but on macOS screenshots end up in the desktop (iCloud Drive) and downloaded images end up on the download folder which isn't backed up to iCloud.

How do you guys use the Photos app?Photos just to save photos or to save any kind of image?"
45,0,[removed],Recommendation for shockproof/drop proof cases for Mac Air A1466,[removed]Recommendation for shockproof/drop proof cases for Mac Air A1466
46,0,"My MacBook, late 2016, will just shut off, say that it restarted because of an error and to press a key or wait a few seconds.   Then once I get in, make 30 seconds later. It usually will restart again, looping.   I will get long periods where it doesn’t restart only to have it restart again after say, a day of use.  I also have noticed it gets extremely hot after it shuts off.  Please help me. ",My MacBook keeps shutting down and restarting in a loop,"My MacBook, late 2016, will just shut off, say that it restarted because of an error and to press a key or wait a few seconds.   Then once I get in, make 30 seconds later. It usually will restart again, looping.   I will get long periods where it doesn’t restart only to have it restart again after say, a day of use.  I also have noticed it gets extremely hot after it shuts off.  Please help me. My MacBook keeps shutting down and restarting in a loop"
47,0,"Hi, 

So I've been considering getting a 15"" 2018 MBP. I was watching a recommended tech review and he said battery life as many people have been talking about is not good. He said with just light browsing he's only getting 3-4 hours of battery life. I know you can't expect the marketed 10 hour number. But seriously 3 hours?? Battery life is probs one of the most important things. 

How many hours are you getting just with light browsing, some Youtube, writing, etc?","Is it true the 15"" 2018 MBP only gets 3-4 hours of battery life?","Hi, 

So I've been considering getting a 15"" 2018 MBP. I was watching a recommended tech review and he said battery life as many people have been talking about is not good. He said with just light browsing he's only getting 3-4 hours of battery life. I know you can't expect the marketed 10 hour number. But seriously 3 hours?? Battery life is probs one of the most important things. 

How many hours are you getting just with light browsing, some Youtube, writing, etc?Is it true the 15"" 2018 MBP only gets 3-4 hours of battery life?"
48,0,[removed],iPhone XR slow WiFi,[removed]iPhone XR slow WiFi
49,0,"Hey there, i hope you can help me. Since a couple of weeks my internet doesnt quite work on my Macbook Air. Its from 2011 and runs 10.14.2

Whenever i try to go online it shows the Wifi Symbol but doesnt get a connection. In the settings it says that it has a self assigned ip and thats it.

I tried to manually set up an ip adress with no luck. Can you help me ?",No Internet but the Wifi Symbol is on,"Hey there, i hope you can help me. Since a couple of weeks my internet doesnt quite work on my Macbook Air. Its from 2011 and runs 10.14.2

Whenever i try to go online it shows the Wifi Symbol but doesnt get a connection. In the settings it says that it has a self assigned ip and thats it.

I tried to manually set up an ip adress with no luck. Can you help me ?No Internet but the Wifi Symbol is on"
50,0,"I'm not sure if there is a trend already for this issue. But ever since I updated to IOS 12.1.2, I can't send SMS messages away from my phone. And my phone is on at all times. Anyone knows if this is a known issue? Thanks!",Apple Watch Series 4 not able to send SMS with Verizon,"I'm not sure if there is a trend already for this issue. But ever since I updated to IOS 12.1.2, I can't send SMS messages away from my phone. And my phone is on at all times. Anyone knows if this is a known issue? Thanks!Apple Watch Series 4 not able to send SMS with Verizon"
51,0,[removed],"When i access something on safari (for example YouTube) the safari app on my ipad also shows YouTube and the same video as well, could not find the option to turn it off. Any help?","[removed]When i access something on safari (for example YouTube) the safari app on my ipad also shows YouTube and the same video as well, could not find the option to turn it off. Any help?"
52,0,"Can anyone comment as to why tap to wake hasn’t been implemented into the previous iPhones like the 7 or 8. I was browsing the XR’s page on the Apple website and I noticed that under the Liquid Retina page, it advertises Tap to Wake coming to the LCD design. Why wasn’t this implemented earlier? Just curious and wanted to learn more. Planning on picking up a XR in the coming weeks :)",Tap to Wake on LCD introduced with the iPhone XR,"Can anyone comment as to why tap to wake hasn’t been implemented into the previous iPhones like the 7 or 8. I was browsing the XR’s page on the Apple website and I noticed that under the Liquid Retina page, it advertises Tap to Wake coming to the LCD design. Why wasn’t this implemented earlier? Just curious and wanted to learn more. Planning on picking up a XR in the coming weeks :)Tap to Wake on LCD introduced with the iPhone XR"
53,0,I have a bunch of vhs tapes that I digitized. Each file corresponds to a single tape but there’s multiple family events within each file that id like to extract into its own file. If possible I’d like to prevent having to convert any of the outputted files to save time. Can this be done with any free Mac apps,Easiest program to break videos into segments?,I have a bunch of vhs tapes that I digitized. Each file corresponds to a single tape but there’s multiple family events within each file that id like to extract into its own file. If possible I’d like to prevent having to convert any of the outputted files to save time. Can this be done with any free Mac appsEasiest program to break videos into segments?
54,0,Like a boom box ,Why didn’t they make the HomePod portable?,Like a boom box Why didn’t they make the HomePod portable?
